{"accepted_patch_correct": null, "drift_category_correct": false, "error_category": null, "exact_location_correct": false, "experiment_id": "phase9_mock_smoke", "false_patch": false, "final_task_success": true, "forbidden_side_effects": 0, "future_transfer": false, "immediate_repair": false, "input_tokens": 623, "latency_ms": 0.0, "llm_calls": 1, "localization": {"confidence": 0.0, "drift_category": "UNKNOWN", "expected_behavior": "", "location_path": null, "location_type": "unknown", "observed_behavior": "", "supporting_evidence_ids": [], "tool_id": "close_issue"}, "method": "oracle_symbolic_upper_bound", "minimality_pass": null, "mock_provider": true, "mode": "end_to_end", "model": "mock-deterministic", "output_tokens": 45, "patch_accepted": false, "patch_proposed": false, "predicted_class": "TF", "probe_calls": 0, "prompt_hash": "64665f925fe2516a7c564d559cce50350286a220085b93174dda1d698f0a1d48", "public_scenario_id": "public-46cdfa236b16", "raw_patch_correct": null, "regression_pass": null, "repetition": 0, "target_tool_correct": true, "termination_reason": "TASK_SUCCESS", "tool_calls": 1, "trace_references": ["tool-001"], "unsafe_action": false, "unsafe_patch": false}
