{"accepted_patch_correct": null, "drift_category_correct": false, "error_category": null, "exact_location_correct": false, "experiment_id": "phase9_mock_smoke", "false_patch": false, "final_task_success": false, "forbidden_side_effects": 0, "future_transfer": null, "immediate_repair": null, "input_tokens": 86, "latency_ms": 0.0, "llm_calls": 1, "localization": {"drift_category": "UNKNOWN", "location_path": null, "location_type": "unknown", "target_tool_id": null}, "method": "retry_only", "minimality_pass": null, "mock_provider": true, "mode": "component", "model": "mock-deterministic", "output_tokens": 65, "patch_accepted": false, "patch_proposed": false, "predicted_class": "INSUFFICIENT_EVIDENCE", "probe_calls": 0, "prompt_hash": "8773e647effcb28e7e070750baca8d03466e295dadc753b8887c3b2df564214f", "public_scenario_id": "public-adeb8ef1688f", "raw_patch_correct": null, "regression_pass": null, "repetition": 0, "target_tool_correct": false, "termination_reason": "COMPONENT_COMPLETE", "tool_calls": 0, "trace_references": [], "unsafe_action": false, "unsafe_patch": false}
