{"accepted_patch_correct": null, "drift_category_correct": null, "error_category": null, "exact_location_correct": null, "experiment_id": "phase9_mock_smoke", "false_patch": false, "final_task_success": false, "forbidden_side_effects": 0, "future_transfer": null, "immediate_repair": null, "input_tokens": 1334, "latency_ms": 0.0, "llm_calls": 2, "localization": null, "method": "validation_guided", "minimality_pass": null, "mock_provider": true, "mode": "end_to_end", "model": "mock-deterministic", "output_tokens": 81, "patch_accepted": false, "patch_proposed": false, "predicted_class": null, "probe_calls": 0, "prompt_hash": "1afbd083f9c16fd308c693abea636b2804cbc5ac3f32155d563171d2560fdaa3", "public_scenario_id": "public-0a949bbdd232", "raw_patch_correct": null, "regression_pass": null, "repetition": 0, "target_tool_correct": null, "termination_reason": "TASK_FAILED", "tool_calls": 1, "trace_references": ["tool-001"], "unsafe_action": false, "unsafe_patch": false}
