{"accepted_patch_correct": true, "drift_category_correct": true, "error_category": null, "exact_location_correct": true, "experiment_id": "phase9_mock_smoke", "false_patch": false, "final_task_success": true, "forbidden_side_effects": 0, "future_transfer": true, "immediate_repair": true, "input_tokens": 631, "latency_ms": 0.0, "llm_calls": 1, "localization": {"confidence": 1.0, "drift_category": "ICD", "expected_behavior": "behavior described by displayed specification", "location_path": "/components/schemas/CreateIssueRequest/required", "location_type": "request_requiredness", "observed_behavior": "Missing required field: priority", "supporting_evidence_ids": ["trace-3cf1c03db24c-EV005"], "tool_id": "create_issue"}, "method": "oracle_symbolic_upper_bound", "minimality_pass": true, "mock_provider": true, "mode": "end_to_end", "model": "mock-deterministic", "output_tokens": 51, "patch_accepted": true, "patch_proposed": true, "predicted_class": "PD", "probe_calls": 0, "prompt_hash": "64665f925fe2516a7c564d559cce50350286a220085b93174dda1d698f0a1d48", "public_scenario_id": "public-3cf1c03db24c", "raw_patch_correct": true, "regression_pass": true, "repetition": 0, "target_tool_correct": true, "termination_reason": "TASK_SUCCESS", "tool_calls": 1, "trace_references": ["tool-001"], "unsafe_action": false, "unsafe_patch": false}
